<?xml version="1.0" encoding="UTF-8" standalone="no"?><!--document of a list of animals in a vet--><animals xmlns:xsi="http://www.w3.org/2001/XMLSchema-instance" xsi:noNamespaceSchemaLocation="animals.xsd"><description>Mon May 13 19:24:16 NZST 2019 Animals</description><animal name="Murray" priority="2" species="cat"><picURL>C:\Users\sinan\OneDrive - AUT University\Year 2, Sem 1\COMP610 - Data Structures and Algorithm\DSA\Assignment2\test.jpg</picURL><symptoms>snotty nose</symptoms><treatment>Maxiclear, deworming</treatment><dateSeen>13-05-2019 19:24:09</dateSeen></animal><animal name="Santas Little Helper" priority="3" species="dog"><picURL>santasLittleHelper.jpg</picURL><dateSeen>05-04-2019 11:15:30</dateSeen></animal><animal name="Tilly" priority="3" species="horse"><picURL>Tilly.jpg</picURL><symptoms>Limp foot</symptoms><treatment>Cast on foot, painkillers</treatment><dateSeen>13-05-2019 19:24:04</dateSeen></animal><animal name="Ciri" priority="3" species="cat"><picURL>ciri.jpg</picURL><symptoms>Sore Paws</symptoms><treatment>Overnight stay, cream on paws</treatment><dateSeen>13-05-2019 19:24:07</dateSeen></animal><animal name="luna" priority="5" species="dog"><picURL>luna.jpg</picURL><symptoms>Checkup</symptoms><treatment>Vacinations given</treatment><dateSeen>05-04-2019 00:00:00</dateSeen></animal></animals>